question,answer,context,grade,eval_description
"What is meant by ""computational finance""?","Computational finance refers to the application of computer algorithms and mathematical models to financial problems. It involves using technology to analyze and make decisions in the financial markets. This field combines finance, mathematics, statistics, and computer science.",,Correct,"The answer provides a clear and concise explanation of computational finance, covering its application, use of technology, and the interdisciplinary nature of the field."
What is meant by 'investor heterogeneity'?,"'Investor heterogeneity' refers to the diversity among investors in terms of their preferences, risk tolerance, investment goals, and strategies. This concept acknowledges that not all investors are the same and that they have varying characteristics that influence their decision-making processes. Understanding investor heterogeneity is crucial for financial markets and investment professionals to tailor their services and products to meet the needs of different types of investors.",,Correct,"The answer provides a clear and comprehensive explanation of what 'investor heterogeneity' means, covering various aspects such as preferences, risk tolerance, investment goals, and strategies. It also highlights the importance of understanding this concept for financial markets and investment professionals."
What was the revolution witnessed by finance in the mid to later part of the 20th century?,"The revolution witnessed by finance in the mid to later part of the 20th century was the shift towards digitalization and globalization. This period saw the rise of electronic trading, financial derivatives, and the integration of financial markets on a global scale. Additionally, there was a significant increase in the use of complex financial instruments and the development of new financial technologies.",,Correct,"The answer provides a comprehensive explanation of the revolution witnessed by finance in the mid to later part of the 20th century, covering key aspects such as digitalization, globalization, electronic trading, financial derivatives, integration of financial markets, complex financial instruments, and new financial technologies."
Why do you think financial markets are viewed as interacting groups of learning and boundedly-rational agents?,"Financial markets are viewed as interacting groups of learning and boundedly-rational agents because participants in these markets continuously learn from past experiences and adjust their strategies accordingly. Bounded rationality refers to the idea that individuals make decisions based on limited information and cognitive abilities, leading to imperfect decision-making. This combination of learning and bounded rationality results in complex interactions and dynamics within financial markets.",,Correct,"The answer provides a clear and concise explanation of why financial markets are viewed as interacting groups of learning and boundedly-rational agents. It effectively highlights the concepts of continuous learning from past experiences, adjusting strategies, bounded rationality, and the resulting complex interactions within financial markets."
Why are the financial markets appealing applications for agent-based methods?,"Financial markets are appealing applications for agent-based methods because experiments can be conducted at reasonable time scales, making it more credible to simulate trading activities. Additionally, financial markets are well-suited for agent-based explorations due to their large, organized nature and the questioning of traditional theoretical structures. Agent-based approaches offer a possibility to solve empirical features that traditional methods have not been able to match in financial markets.","behavior. Several of the models covered here have already done this, and more examples of using experiments
are given in Duﬀy (2005). Finance experiments are particularly appealing since they often can be done at
time scales that are reasonable for the real data. It is more credible that you can simulate a day of trading
in the laboratory, than to simulate someone’s entire life cycle.
To summarize, ﬁnancial markets are particularly well suited for agent-based explorations. They are
large well-organized markets for trading securities which can be easily compared. Currently, the established
theoretical structure of market eﬃciency and rational expectations is being questioned. There is a long list of
empirical features that traditional approaches have not been able to match. Agent-based approaches provide
an intriguing possibility for solving some of these puzzles.21Finally, ﬁnancial markets are rich in data sets",Correct,"The answer provides a clear and detailed explanation of why financial markets are appealing applications for agent-based methods. It discusses the credibility of simulations, the suitability of financial markets for agent-based explorations, and the potential of agent-based approaches to address empirical features that traditional methods cannot match."
What are the different design questions in constructing an agent-based financial market?,"The different design questions in constructing an agent-based financial market include a large number of basic design questions that must be answered. Unfortunately, there is often little guidance on which direction to follow. These questions will be seen again as the setup of different markets is covered in later parts of the survey.","The remainder of this chapter will summarize recent work on agent-based computational models in
ﬁnance. The next section introduces some of the computational tools and design issues that are important
in building markets. Section 3 covers artiﬁcial market models that attempt to recreate an entire market.
Section 4 covers a few other types of markets which do not ﬁt into the earlier categories. Section 5 covers
some on-going debates and criticisms of agent-based markets, and section 6 concludes and suggests questions
for the future.
2 Design questions
In constructing an agent-based ﬁnancial market the researcher is faced with a large number of basic design
questions that must be answered. Unfortunately, there is often little guidance on which direction to follow.
This section brieﬂy overviews most of these questions which will be seen again as the setup of diﬀerent
markets is covered in later parts of this survey.",Correct,The answer provides a clear and comprehensive explanation of the different design questions involved in constructing an agent-based financial market. It also mentions the importance of these questions and hints at their relevance in later parts of the survey.
Discuss Lettau’s framework using various mathematical formulae.,"Lettau's framework involves using the optimal linear functional form for agent i, represented by the formula si=αi(¯d−p). Agents need to learn the optimal α for their portfolios. The genetic algorithm is used to redraw agent parameters, with αi determined by a bitstring encoding formula.","but Lettau simpliﬁes this by using the optimal linear functional form for agent i,
si=αi(¯d−p). (7)
This gives the agents a head start on the portfolio problem, but they still need to learn the optimal α.28
The market is run for Speriods with new independent draws of the dividend for each period. Each agent
continues to use the portfolio determined by αi, which remains ﬁxed. At the end of each block of Sthe
genetic algorithm (GA) is run, and the set of agent parameters is redrawn. Agents are parameterized with
a bitstring encoding given by
αi=MIN + (MAX −MIN )∑L
j=1µj,i2j−1
2L−1(8)
where µj,iis the bitstring for the strategy of agent i. The GA ﬁrst gets a ﬁtness value for each agent estimated
over the Speriods using
Vi=S∑
s=1U(wi,s). (9)
This sets the ﬁtness to the ex post estimated expected utility over the sample. A new population is chosen
using a technique known as “ﬁtness proportional” selection. Each agent is assigned a probability using
pi=1/Vi∑J
j=1(1/Vj). (10)",Correct,"The student has provided a clear explanation of Lettau's framework, including the optimal linear functional form for agent i and the use of genetic algorithm to determine optimal parameters. The answer demonstrates understanding of the mathematical formulas involved."
The exchange rate is given by what formula?,"The exchange rate is given by et=p1,t/p2,t. Agents care about the relative returns of the two currencies in terms of money holdings. The demand for savings is determined by the agents' maximization problem.","good, which has a price in each currency. The exchange rate is given by
et=p1,t
p2,t. (11)
Given this setup, all agents care about in terms of money holdings are the relative returns of the two
currencies. In an equilibrium where both currencies are held, these returns must be equal.
Rt=p1,t
p1,t+1=p2,t
p2,t+1. (12)
It is also easy to show that the agents’ maximization problem yields the following demand for savings:
st=m1,t
p1,t+m2,t
p2,t=1
2(w1−w21
Rt) (13)
The model has a fundamental indeterminacy in that, if there exists one price series and an exchange
rate paring that constitutes an equilibrium, then there will exist inﬁnitely many such equilibria. One of
the interesting issues that Arifovic is exploring is whether the GA learning mechanism will converge to a
single exchange rate. Sargent (1993) explored this same question; he found that certain learning algorithms
converge, but the ﬁnal exchange rate depends on the starting value.",Correct,"The answer provided correctly explains that the exchange rate is given by et=p1,t/p2,t, and mentions that agents care about the relative returns of the two currencies in terms of money holdings. Additionally, it states that the demand for savings is determined by the agents' maximization problem."
Discuss the criticisms of agent-based markets.,"Agent-based markets have been criticized for having too many parameters, with the impact of many of these parameters not well understood. Additionally, these models have utilized a wide range of computational tools and methods, leading to concerns about their complexity and validity. The diversity in design structures of agent-based financial market models further highlights the varied approaches and features used in these models.","numbers are, but this is an interesting test of the minority game model on real data.54
5 Cautions and criticisms
Agent-based markets have been criticized from many diﬀerent angles. The most common criticism is that the
models have far too many parameters, and the impact of many of these parameters is not well understood.
This issue has already been discussed in the section on calibration. However, beyond simple parameter
questions, these models have made use of a wide selection of the available computational tools and methods.
Table 1 gives a short overview of the design structures of some of the agent-based ﬁnancial market models
described in this paper. This is far from being an all inclusive list, since many of the models described in this
chapter would not ﬁt well into the criteria for the list. This emphasizes what should have become clear from
the earlier sections: agent-based ﬁnancial models have been built using many diﬀerent features and designs.",Correct,"The answer provides a comprehensive discussion of the criticisms of agent-based markets, highlighting concerns about the number of parameters, the use of various computational tools, and the diversity in design structures. The response is well-structured and covers key points effectively."
How is timing an ignored final problem?,"Timing is an ignored final problem because in analytic settings, multiple events can be assumed to occur simultaneously, but in computers, the sequence of events must be specified. The degree to which results depend on timing decisions is significant, as seen in examples like delayed price adjustments based on market demand. In a world of evolving strategies, timing can have a significant impact on outcomes.","make these choices, but in analytic settings more events can be assumed to take place simultaneously. In
the computer this sequence of events often needs to be spelled out. The degree to which results depend on
arbitrary timing decisions is deﬁnitely important. One example that has been discussed here is the delayed
price adjustment approach, where prices are adjusted based on current excess demand in the market. It
is important to note that in a world of evolving strategies, this timing may have a large impact since the
39",Correct,The answer provides a clear explanation of why timing is considered an ignored final problem in computer systems. It discusses the importance of specifying the sequence of events in computers and gives relevant examples to support the explanation.
What is the earliest that I can depart from Downtown on the Express Bus?,I don't know.,"the b us at the Downtown Terminal to arrive at the college on time for all classes. Enter 
the information into the agenda  for each day .  You should arrive at class 15 minutes 
before it begins.  
 
Task 3:  You are meeting friends  downtown  for dinner at 6 p.m. on Wednesday. What time does 
the bus leave after your last class on Wednesday  that would allow you to meet your 
friends on time ?  
 
 
Task 4:  Name the two building s where  your classes will be held according to the class schedule.",Incorrect,The answer provided does not address the question asked. It is important to provide a specific time or range for the earliest departure from Downtown on the Express Bus.
Is it a departure from the College stop after 5:00 pm?,I don't know.,"the b us at the Downtown Terminal to arrive at the college on time for all classes. Enter 
the information into the agenda  for each day .  You should arrive at class 15 minutes 
before it begins.  
 
Task 3:  You are meeting friends  downtown  for dinner at 6 p.m. on Wednesday. What time does 
the bus leave after your last class on Wednesday  that would allow you to meet your 
friends on time ?  
 
 
Task 4:  Name the two building s where  your classes will be held according to the class schedule.",Incorrect,The answer provided does not demonstrate an understanding of the concept. It is important to review the schedule and understand the timing of the departure from the College stop after 5:00 pm.
What are the destinations of the express bus?,I don't know.,"the b us at the Downtown Terminal to arrive at the college on time for all classes. Enter 
the information into the agenda  for each day .  You should arrive at class 15 minutes 
before it begins.  
 
Task 3:  You are meeting friends  downtown  for dinner at 6 p.m. on Wednesday. What time does 
the bus leave after your last class on Wednesday  that would allow you to meet your 
friends on time ?  
 
 
Task 4:  Name the two building s where  your classes will be held according to the class schedule.",Incorrect,The answer provided does not address the question asked. It is important to provide a clear response even if you are unsure.
at what time is the last opportunity someone could take the express bus from the college campus to downtown?,I don't know.,"the b us at the Downtown Terminal to arrive at the college on time for all classes. Enter 
the information into the agenda  for each day .  You should arrive at class 15 minutes 
before it begins.  
 
Task 3:  You are meeting friends  downtown  for dinner at 6 p.m. on Wednesday. What time does 
the bus leave after your last class on Wednesday  that would allow you to meet your 
friends on time ?  
 
 
Task 4:  Name the two building s where  your classes will be held according to the class schedule.",Incorrect,The answer provided does not address the question asked. It is important to pay attention to the details of the question and provide a relevant response.
What was the gross profit of three months ended in 2013?,The gross profit for the three months ended in 2013 was not provided in the given context.,"and an increase of $3.8 million  from the second quarter of 2013 due to higher payroll largely attributable to the 
expansion of our sales force and marketing team to serve the C&I channel, increased marketing costs, and share -based 
compensation expenses for new awards granted in connection with the IPO. 
●Net income was $2.0 million , a decrease from $3.9 million  in the first quarter of 2014 and a decrease from $4.6 million  in 
the second quarter of 2013.  Diluted earnings per share were $0.10, a decrease from diluted earnings per share of 
$0.19 in the first quarter of 2014 and a decrease from diluted earnings per share of $0.22 in the second quarter of 2013.
●Adjusted EBITDA was $7.7 million , compared to $10.0 million  in the first quarter of 2014 and $12.4 million  in the second 
quarter of 2013.
At June 30, 2014 , cash and cash equivalents were $16.1 million , down from $23.0 million  at March 31, 2014 . On July 1, 2014 ,",Incorrect,The answer does not directly address the question asked. It should provide the specific gross profit amount for the three months ended in 2013.
How much percentage difference of goods sold between the six months and three months ended is?,The percentage difference of goods sold between the six months and three months ended is 65%.,"$18.2 million , or 65%, from the second quarter of 2013, driven by increased sales in the commercial and industrial, 
or C&I, channel and with Walmart.
●CFL sales were $59.5 million , roughly flat from the first quarter of 2014 and down $12.4 million , or 17%, from the 
second quarter of 2013, primarily due to the transition to LEDs in the C&I channel and lower volume with The 
Home Depot. 
●Gross margin was 22.7%, down from 24.5% in the first quarter of 2014 and down from 24.3% in the second quarter of 
2013 due to the absence of favorable profit margins on a one -time order in 2013 and an increase in the provision for 
excess and obsolete inventory.   
●Selling, general and administrative expenses were $20.4 million , an increase of $3.5 million  from the first quarter of 2014 
and an increase of $3.8 million  from the second quarter of 2013 due to higher payroll largely attributable to the",Incorrect,"The answer provided is incorrect. The percentage difference should be calculated based on the actual values of goods sold for the two time periods, not just a percentage value."
In which year were there the greatest total assets?,"The greatest total assets were in the year 2014 with a total of $355,866.","2014 2013
Assets
Current assets:
Cash and cash equivalents $    16,091 $    21,903
Restricted cash 6,666 3,404
Accounts receivable, less allowance for doubtful accounts of $1,416 and
82,634 59,574     $1,479 at June 30, 2014  and December 31, 2013 , respectively
Inventories 116,872 119,477
Prepaids and other current assets 18,826 14,415
Deferred income taxes 9,030 10,551
Total current assets 250,119 229,324
Property, plant and equipment, net of accumulated depreciation of $39,965 and
70,924 74,558    $39,007 at June 30, 2014  and December 31, 2013  respectively
Land rights, net 4,154 4,244
Deferred costs 18,364 18,732
Finance receivables from related parties — 1,915
Intangible assets, net of accumulated amortization of $861 and $837 at June 30,
2,826 2,993    2014 and December 31, 2013 , respectively
Deferred income taxes, long -term 7,772 7,758
Other long -term assets 1,707 1,741
Total assets $   355,866 $   341,265
Liabilities and Shareholders' Equity
Current liabilities:",Correct,"The answer provides the correct information by stating that the greatest total assets were in the year 2014 with a total of $355,866."
In which year were there the greatest total liabilities?,"The greatest total liabilities were in the year 2014 with a total of $346,350.","Deferred income taxes, long -term 7,772 7,758
Other long -term assets 1,707 1,741
Total assets $   355,866 $   341,265
Liabilities and Shareholders' Equity
Current liabilities:
Short-term loans and current portion of long -term debt $   138,711 $   122,840
Accounts payable 103,835 105,742
Accrued expenses and other current liabilities 59,208 62,539
Total current liabilities 301,754 291,121
Long-term debt, net of current portion  5,442 7,553
Income taxes payable, long -term 7,410 7,043
Legal settlements, net of current portion 31,232 30,941
Other long -term liabilities  512 427
Total liabilities 346,350 337,085
Commitments and contingencies
Shareholders' equity:
Common stock, CHF 1.00 par value; 41,107 shares authorized; 20,553
22,048 22,048    issued and outstanding at June 30, 2014  and December 31 , 2013 
Additional paid -in capital 2,553 901
Accumulated other comprehensive income 13,237 13,721
Retained deficit (28,322) (32,490)
Total shareholders' equity 9,516 4,180",Correct,"The answer provides the correct information by stating that the greatest total liabilities were in the year 2014 with a total of $346,350. Well done."
How varied were the subjects of the different Oregon section meetings?,"The subjects of the Oregon Section meetings varied, including presentations on the Columbia River Crossing project and announcements of newly elected officers. The meetings covered topics related to transportation and traffic control devices. The meetings also included joint sessions with other professional societies.","Oregon Section 2007/2008 Annual Report  
Institute of Transportation Engineers  Page 7 of 13  5.  MEETINGS  
The Oregon Section conducted six (6) general meetings and the sum mer golf tournament over the 
past year, as well as hosting Joint 2007 ITE District 6 annual me eting. The general meetings included 
luncheons with speakers, joint-meetings with other professional s ocieties, the annual traffic bowl, and 
a technical workshop. The table below summarizes the general meet ings conducted over the past year 
and those scheduled for the remainder of 2008.   
SOREGON SECTION MEETINGS 
Date Meeting Subject Location Attendees 
4-10-07 April - Joint 
meeting with 
WTS Kris Strickler and Danielle Cogan gave a 
presentation on the Columbia River Crossing 
project on the I-5 bridge that connects Oregon 
and Washington. Embassy Suites 
Hotel 
Portland, OR 60 
5-18-07 May - Joint 
meeting with 
Oregon Traffic 
Control Devices 
Committee 
(OTCDC) Sections newly elected officers were announced",Correct,"The answer provides a detailed explanation of the varied subjects discussed in the Oregon Section meetings, including specific examples such as the Columbia River Crossing project and joint sessions with other professional societies. The response is well-structured and covers multiple aspects of the meetings."
What is the Oregon Section's annual Traffic Bowl Competition?,"The Oregon Section's annual Traffic Bowl Competition is a Jeopardy-based trivia contest where students answer questions on traffic and transportation trivia. The competition was held on November 15, 2007 at McMenamin's Edgefield near Portland, Oregon. University of Portland won the grand prize of bragging rights, a trophy, and a $400 scholarship.","Oregon Section 2007/2008 Annual Report  
Institute of Transportation Engineers  Page 10 of 1 3 7.  STUDENT CHAPTER ACTIVITIES 
The Student Liaison Committee had another successful year in attracting schools from the Pacific 
Northwest to compete in the Oregon Section's annual Traffic Bowl Competition. The Traffic Bowl is 
a Jeopardy-based trivia contest where students must answer ques tions on a variety of traffic and 
transportation trivia. This year the competition was held on Novem ber 15, 2007 at McMenamin's 
Edgefield just east of Portland, Oregon.  
This year we had 52 students from six universities attending the event. Par ticipating schools were: 
/square4 Portland State University 
/square4 University of Idaho 
/square4 University of Portland 
/square4 Oregon State University 
/square4 University of Washington 
/square4 Oregon Institute of Technology 
 
University of Portland took home the grand prize of bragging rights , a trophy and a $400 scholarship",Correct,"The answer provides a detailed explanation of the Oregon Section's annual Traffic Bowl Competition including the format, location, date, and the prize. Well done."
