question,answer,context,grade,eval_description
What are the standard rules of a golf game?,I don't know.,"“business school.” This allows for some strategy learning to occur across agents in a very natural way.38
The rules in the common pool are evolved according to forecast accuracy. Traders then decide to update
their own strategies based on current performance. They draw rules from the common pool, comparing their
performance with their current rules. If the new rule is better they switch, but if they are unsuccessful after
several tries, they quit and stay with their current rule.

 ------------A second important innovation is the use of a common pool of rules, which the authors refer to as a
“business school.” This allows for some strategy learning to occur across agents in a very natural way.38
The rules in the common pool are evolved according to forecast accuracy. Traders then decide to update
their own strategies based on current performance. They draw rules from the common pool, comparing their","['Incorrect', 'Incorrect', 'Incorrect']","['The answer provided does not address the question and shows a lack of understanding of the topic.', 'The answer provided does not demonstrate knowledge of the standard rules of a golf game. It is important to review the rules and provide a more accurate response next time.', 'The answer provided does not demonstrate an understanding of the standard rules of a golf game. It is important to review the rules and provide a more accurate response next time.']"
How do you think the token gifts motivate the speakers?,"The token gifts, such as USB thumb drives and handmade coffee mugs, serve as a gesture of appreciation for the speakers. These gifts likely motivate the speakers by showing recognition and gratitude for their participation. The sponsorship by Western Systems and NW Signal also contributes to the motivation of the speakers by supporting the event.","Western Systems and NW Signal sponsored the event. 
 
Speaker Appreciation Gifts: 
It is the Oregon Section’s tradition to recognize the speaker a t the Monthly Section Meetings and 
various other guests of the Section by presenting them with a token gift. USB thumb drives printed 
with an Oregon ITE logo were purchased as speaker gifts this year, as were handmade coffee mugs 
with the Oregon ITE logo. 
 
District 6 Meeting - Local Arrangements Committee:

 ------------Counts, Parsons Brinkerhoff, Inc., Kittelson & Asso ciates, Inc., All Traffic Data Services, TrafStats,  
Western Systems and NW Signal sponsored the event. 
 
Speaker Appreciation Gifts: 
It is the Oregon Section’s tradition to recognize the speaker a t the Monthly Section Meetings and 
various other guests of the Section by presenting them with a token gift. USB thumb drives printed 
with an Oregon ITE logo were purchased as speaker gifts this year, as were handmade coffee mugs","['Correct', 'Correct', 'Correct']","['The answer provides a clear explanation of how token gifts motivate the speakers by showing appreciation, recognition, and gratitude. It also mentions the additional motivation provided by the sponsorship from Western Systems and NW Signal.', 'The answer provides a clear explanation of how token gifts motivate the speakers by showing appreciation, recognition, and gratitude. It also mentions the additional motivation provided by the sponsorship from Western Systems and NW Signal.', 'The answer provides a clear explanation of how token gifts motivate the speakers by showing appreciation, recognition, and gratitude. It also mentions the additional motivation provided by the sponsorship from Western Systems and NW Signal.']"
How was the District 6 meeting a huge success?,"The District 6 meeting was a huge success with over 500 attendees and a well-organized event by the committee chaired by Peter Koonce. Highlights included exam offerings, student competitions, and numerous technical sessions. The meeting aimed to better coordinate district and quad meetings for a win-win situation.","Sections). 
The District 6 meeting was a huge success in that it attracted over 500 at tendees. The committee, 
chaired by Peter Koonce, was responsible for setting up a great techni cal and social event for the 
members of District 6. Some of the highlights include: 
/crosstar2 PTOE/PTP/TSOS/TOPS Exam Offering 
/crosstar2 James H. Kell Student Competition 
/crosstar2 36 Technical Sessions 
/crosstar2 2 Poster Sessions

 ------------Section in order to better coordinate the district and quad meetings (a w in-win situation for both 
Sections). 
The District 6 meeting was a huge success in that it attracted over 500 at tendees. The committee, 
chaired by Peter Koonce, was responsible for setting up a great techni cal and social event for the 
members of District 6. Some of the highlights include: 
/crosstar2 PTOE/PTP/TSOS/TOPS Exam Offering 
/crosstar2 James H. Kell Student Competition 
/crosstar2 36 Technical Sessions","['Correct', 'Correct', 'Correct']","[""The answer provides specific details about the District 6 meeting, highlighting the number of attendees, organization, key events, and the meeting's objective. It is well-written and addresses the question effectively."", ""The answer provides specific details about the District 6 meeting, highlighting the number of attendees, organization of the event, key activities, and the meeting's objective. It effectively explains why the meeting was considered a huge success."", 'The answer provides specific details about the District 6 meeting, highlighting the number of attendees, the organization of the event, and the key activities that took place. It also mentions the purpose of the meeting, which was to improve coordination between district and quad meetings.']"
Which award was granted over the past year? To whom was it given?,The Traffic Bowl - First Place Award was granted over the past year. It was given to the University of Portland to encourage student participation in the Oregon Section ITE.,"9.   AWARDS                             
 
The Oregon Section recognized several groups and individuals during 2007-08. The Section provided 
over $1,450 in awards to various ITE Student Sections throughout the gr eater Northwest. The awards 
granted over the past year are summarized below. 
 
Award Name: Traffic Bowl - First Place Award   
Recipient's Name:  University of Portland 
Purpose of Award:  To Encourage Student Participation in Oregon Section ITE

 ------------Oregon Section 2007/2008 Annual Report  
Institute of Transportation Engineers  Page 13 of 1 3  
9.   AWARDS                             
 
The Oregon Section recognized several groups and individuals during 2007-08. The Section provided 
over $1,450 in awards to various ITE Student Sections throughout the gr eater Northwest. The awards 
granted over the past year are summarized below. 
 
Award Name: Traffic Bowl - First Place Award   
Recipient's Name:  University of Portland","['Correct', 'Correct', 'Correct']","['The answer provides a clear and accurate response to the question by identifying The Traffic Bowl - First Place Award as the award granted over the past year and specifying that it was given to the University of Portland to encourage student participation in the Oregon Section ITE.', 'The answer provides a clear and accurate response to the question by identifying The Traffic Bowl - First Place Award as the award granted over the past year and specifying that it was given to the University of Portland to encourage student participation in the Oregon Section ITE.', 'The answer provides a clear and accurate response to the question by stating that the Traffic Bowl - First Place Award was granted over the past year and specifying that it was given to the University of Portland to encourage student participation in the Oregon Section ITE.']"
How do you think sexual harassment as an issue is peculiar to Australian workplaces?,Sexual harassment in Australian workplaces has persisted despite legislation prohibiting it since 1984. The current laws have not been effective in preventing this behavior. Employers have a positive obligation to address sexual harassment in the workplace.,"Maurice Blackburn Lawyers submission to the National Inquiry into Sexual Harassment in Australian Workplaces . 
Page 7 
  
i. Positive obligation on employers  
 
Sexual harassment in the workplace has been prohibited in Australia since the passing of the 
Sex Discrimination Act 1984  (Cth) (‘ SDA ’). However, the persistent prevalence of sexual 
harassment within Australian workplaces since that time suggests that the current legislation 
has failed in preventing this kind of conduct.

 ------------7 Everyone’s business: Fourth National Survey on Sexual Harassment in Australian Workplaces, p63 . 
8 Paula McDonald, Sara Charlesworth,  Tina Graham  (2015) Asia Pacific Journal  of Human Resources  ‘Developing 
a framework of effective prevention and response strategies in workplace sexual harassment ’, Vol 53, Issue 1.  
9 Everyone’s business: Fourth National Survey on Sexual Harassment in Australian Workplaces , p63.  
10 S106 of the Sex Discrimination Act 1984 (Cth).","['Correct', 'Correct', 'Correct']","['The answer provides a clear explanation of the persistence of sexual harassment in Australian workplaces despite legislation. It also mentions the ineffectiveness of current laws and the positive obligation of employers to address the issue.', 'The answer provides a clear explanation of the persistence of sexual harassment in Australian workplaces despite legislation. It also mentions the ineffectiveness of current laws and the positive obligation of employers to address the issue.', 'The answer provides a clear explanation of the persistence of sexual harassment in Australian workplaces despite legislation, the ineffectiveness of current laws, and the positive obligation of employers to address the issue.']"
What legislative suggestions pertaining to workplace sexual harassment does the firm provide in its submission?,"The firm suggests that the SDA should impose a positive obligation on employers to prevent sexual harassment in the workplace. They also recommend that State and Territory WHS authorities be authorized to investigate and sanction employers who breach their duty to provide safe workplaces, especially in cases of sexual harassment.","Our s ubmission s in response to ToR 4:  
 
That the SDA should impose a positive obligation on employers to take all reasonable steps 
to prevent sexual harassment occurring in the workplace, whether an incident  has occurred 
or not.  
 
That State and Territory WHS  authorities be explicitly authorised to investigate and impose 
sanctions on employers who have breached their duty to provide safe and without risk 
workplaces, particularly in the context of sexual harass ment.

 ------------Submission in Response 
to the National Inquiry into 
Sexual Harassment in 
Australian Workplaces  
 
 
February 2019","['Correct', 'Correct', 'Correct']","['The student accurately identifies the legislative suggestions provided by the firm regarding workplace sexual harassment, including imposing a positive obligation on employers and authorizing State and Territory WHS authorities to investigate and sanction breaches.', 'The student accurately identifies the legislative suggestions provided by the firm regarding workplace sexual harassment, including imposing a positive obligation on employers to prevent sexual harassment and authorizing State and Territory WHS authorities to investigate and sanction employers for breaching their duty to provide safe workplaces.', 'The student accurately identifies the legislative suggestions provided by the firm regarding workplace sexual harassment, including imposing a positive obligation on employers and authorizing State and Territory WHS authorities to investigate and sanction breaches.']"
How does the scarcity of data on mediations impact the efficacy of the Complaints Process?,"The scarcity of data on mediations impacts the efficacy of the Complaints Process by limiting the understanding of outcomes in anti-discrimination matters. Without sufficient data, it is challenging to assess the effectiveness of the mediation process in achieving statutory objectives.","Below we have identified three additional issues which impact the efficacy of the Complaints 
Process. They are related to:  
 
 Scarcity of data on med iations;  
 Employer tactics ; and  
 The mediation process  
 
These are discussed in more detail below:  
 
Scarcity of Data  on Mediations  
 
It should be noted that there have been very few Australian studies which have examined 
the outcomes of the mediation  process with respect to anti -discrimination matters, and

 ------------statutory objectives.  
 
Below we have identified three additional issues which impact the efficacy of the Complaints 
Process. They are related to:  
 
 Scarcity of data on med iations;  
 Employer tactics ; and  
 The mediation process  
 
These are discussed in more detail below:  
 
Scarcity of Data  on Mediations  
 
It should be noted that there have been very few Australian studies which have examined","['Correct', 'Correct', 'Correct']","['The answer provides a clear explanation of how the scarcity of data on mediations affects the efficacy of the Complaints Process. It highlights the importance of data in assessing the effectiveness of the mediation process in anti-discrimination matters.', 'The answer provides a clear explanation of how the scarcity of data on mediations affects the efficacy of the Complaints Process. It highlights the importance of data in assessing the effectiveness of the mediation process in anti-discrimination matters.', 'The answer provides a clear explanation of how the scarcity of data on mediations affects the efficacy of the Complaints Process by highlighting the limitation in understanding outcomes and assessing effectiveness.']"
What and why the firm designates as one of the significant failings of the current legislative scheme?,Maurice Blackburn designates the onus on victims to seek redress as a significant failing of the current legislative scheme. They believe employers should have a positive obligation to prevent harm in the first place. They advocate for enforceable sanctions against employers who fail to provide a safe workplace.,"Maurice Blackburn is of the view that one of the signif icant failings of the current legislative 
scheme is the onus it places on victims to seek redress for the harm they have suffered, 
rather than placing a positive obligation on employers to prevent the harm occurring in the 
first instance. We believe there should be enforceable sanctions against employers who fail 
in their duty to provide a safe workplace for their employees.

 ------------Maurice Blackburn is of the view that one of the significant failings of the current legislative 
scheme is the onus it places on victims to seek redress for the harm they have suffered, 
rather than placing a positive obligation on employers to prevent the harm occurring in the 
first instance.   
 
The current legislative scheme requires victims of sexual harassment to take the step of 
making a complaint before they are able to pursue a remedy in relation to the unlawful","['Correct', 'Correct', 'Correct']","[""The student correctly identifies the onus on victims to seek redress as a significant failing of the current legislative scheme and provides a clear explanation of Maurice Blackburn's stance on the issue."", ""The student accurately identifies the onus on victims to seek redress as a significant failing of the current legislative scheme. The answer also correctly mentions Maurice Blackburn's belief that employers should have a positive obligation to prevent harm and advocate for enforceable sanctions against employers who fail to provide a safe workplace."", 'The student correctly identifies the onus on victims to seek redress as a significant failing of the current legislative scheme. The answer also includes the suggestion that employers should have a positive obligation to prevent harm and advocate for enforceable sanctions against non-compliant employers.']"
In what cases should online sexual harassment be criminalized according to the submission?,"Online sexual harassment should be criminalized when individuals are seeking injunctive relief and damages from the perpetrators of the harassment, as well as from the providers and facilitators of online platforms where the harassment occurs. It is important to give individuals legal tools to combat online sexual harassment effectively. The discussion on criminality and penalties should also consider cases where providers or facilitators fail to monitor and protect users from harassment.","sexual harassment in Australia might be implemented.  
 
4. That any discussion on criminality and penalties designed to combat on -line sexual 
harassment must also recognise that it is important to give individuals the legal tools 
to allow them to:  
 Seek inj unctive relief and damages from the perpetrators of on -line sexual 
harassment, and  
 Seek injunctive relief and damages from the providers and facilitators of online

 ------------4. That any discussion on criminality and penalties designed to combat on -line sexual 
harassment must also recognise that it is important to give individuals the legal tools 
to allow them to:  
 Seek inj unctive relief and damages from the perpetrators of on -line sexual 
harassment, and  
 Seek injunctive relief and damages from the providers and facilitators of online 
forums where the provider or facilitator has failed to discharge a duty to 
monitor and prote ct users.","['Correct', 'Correct', 'Correct']","['The answer provides a clear explanation of when online sexual harassment should be criminalized, mentioning seeking injunctive relief and damages, legal tools for combating harassment effectively, and the responsibility of providers and facilitators to monitor and protect users.', 'The student has provided a comprehensive answer outlining the cases in which online sexual harassment should be criminalized. The response demonstrates a clear understanding of the topic and includes relevant points regarding seeking legal remedies, holding perpetrators accountable, and the role of online platforms in preventing harassment.', 'The answer provides a clear explanation of when online sexual harassment should be criminalized, mentioning seeking injunctive relief and damages, legal tools for combating harassment, and the responsibility of providers and facilitators to monitor and protect users.']"
