question,answer,context,grade,eval_description
"What is meant by ""computational finance""?",Computational finance refers to using computational power to analyze financial data and models. It involves viewing financial markets as groups of interacting agents with varying abilities and attitudes. The computer plays a central role in understanding the dynamics of these markets in agent-based computational models.,"to ﬁnancial economists as it is potentially unappealing to ﬁnancial practitioners.1It is interesting to note
that these foundations came with a very important computational dimension. The early availability of large
machine-readable data sets, and the computational power to analyze them, laid the critical foundation for
this new ﬁnancial rigor.2In agent-based computational models the computer is once again at the center
of a change in thinking about ﬁnancial markets. This time it is helping to pursue a world view in which
agents may diﬀer in many ways, not just in their information, but in their ability to process information,
their attitudes toward risk, and in many other dimensions.
Models in the realm of agent-based computational ﬁnance view ﬁnancial markets as interacting groups
of learning, boundedly-rational agents. The computer may or may not be a necessary tool to understand
the dynamics of these markets. This survey will concentrate on the cases where analytic solutions would",Correct,"The answer provides a clear and concise explanation of computational finance, highlighting the use of computational power in analyzing financial data and models, as well as the role of computers in understanding market dynamics."
What is meant by 'investor heterogeneity'?,'Investor heterogeneity' refers to the diversity of agents or wealth across different strategies in agent-based financial markets. This dynamic heterogeneity plays a critical role in how optimizing agents respond to the distribution of strategies. The complexity of the state space often leads to bounded rationality for both agents and modelers.,"from other more general heterogeneous agent models in ﬁnance, since the latter have been part of the ﬁeld
for some time.4In agent-based ﬁnancial markets, dynamic heterogeneity is critical. This heterogeneity is
represented by a distribution of agents, or wealth, across either a ﬁxed or changing set of strategies. In
principle, optimizing agents would respond optimally to this distribution of other agent strategies, but in
general, this state space is far too complicated to begin to calculate an optimal strategy, forcing some form
of bounded rationality on both agents and the modeler. It is important to note that in these worlds bounded
rationality is driven by the complexity of the state space more than the perceived limitations of individual
agents. It is also important to remember that the simpliﬁed rules of thumb used by agents do not suggest
that the exercise is forcing some sort of simpliﬁed solution on the dynamics of the steady state or the model,",Correct,The answer provides a clear and concise explanation of 'investor heterogeneity' by describing it as the diversity of agents or wealth across different strategies in agent-based financial markets. It also mentions the critical role it plays in how optimizing agents respond to the distribution of strategies and the bounded rationality that arises due to the complexity of the state space.
What was the revolution witnessed by finance in the mid to later part of the 20th century?,"The revolution witnessed by finance in the mid to later part of the 20th century was driven by the advent of the efficient markets hypothesis, the capital asset pricing model, and the Black/Scholes options pricing formula. These developments put the field on a new, solid scientific foundation based on the assumption that asset markets were powerful computational engines. This computational dimension was supported by the early availability of large machine-readable data sets and the computational power to analyze them.","1 Introduction
In the mid to later part of the 20th century, ﬁnance witnessed a revolution. The advent of the eﬃcient
markets hypothesis, the capital asset pricing model, and the Black/Scholes options pricing formula put the
ﬁeld on a new, solid scientiﬁc foundation. This world was built on the assumption that asset markets were
powerful computational engines, and were able to aggregate and process the beliefs and demands of traders,
leaving in prices the full set of properly processed information currently available. At the core of asset
pricing, eﬃcient market theories give a clean and compelling picture of the world which is as appealing
to ﬁnancial economists as it is potentially unappealing to ﬁnancial practitioners.1It is interesting to note
that these foundations came with a very important computational dimension. The early availability of large
machine-readable data sets, and the computational power to analyze them, laid the critical foundation for",Correct,"The answer provides a detailed explanation of the revolution witnessed by finance in the mid to later part of the 20th century, mentioning key developments such as the efficient markets hypothesis, the capital asset pricing model, and the Black/Scholes options pricing formula. It also highlights the shift towards a more scientific foundation and the role of computational analysis supported by data sets and computational power."
Why do you think financial markets are viewed as interacting groups of learning and boundedly-rational agents?,"Financial markets are viewed as interacting groups of learning and boundedly-rational agents because key debates about market efficiency and rationality remain unresolved in finance. Additionally, financial time series present puzzles that are not well understood, leading to the need for agents to learn and adapt. The wealth of pricing and volume data in financial markets allows for analysis and approximation of fitness through wealth or return performance.","Financial markets are particularly appealing applications for agent-based methods for several reasons.
First, the key debates in ﬁnance about market eﬃciency and rationality are still unresolved. Second, ﬁnancial
time series contain many curious puzzles that are not well understood. Third, ﬁnancial markets provide a
wealth of pricing and volume data that can be analyzed. Fourth, when considering evolution, ﬁnancial
markets provide a good approximation to a crude ﬁtness measure through wealth or return performance.
Finally, there are strong connections to relevant experimental results that in some cases operate at the same
time scales as actual ﬁnancial markets.
Academic ﬁnance has debated the issue of market eﬃciency for some time. The concept of market
eﬃciency has a strong theoretical and empirical backing which should not be ignored.5On the theoretical
side, the argument is that traders with less than rational strategies will disappear, and if prices contain any",Correct,"The answer provides a clear explanation of why financial markets are viewed as interacting groups of learning and boundedly-rational agents. It covers key debates, puzzles in financial time series, the need for agents to learn and adapt, and the use of pricing and volume data for analysis."
Why are the financial markets appealing applications for agent-based methods?,"Financial markets are appealing applications for agent-based methods because experiments can be done at reasonable time scales, making them more credible. Additionally, financial markets are well-suited for agent-based explorations due to their large, organized nature and the availability of rich data sets for testing models. Traditional approaches in finance are being questioned, and agent-based methods offer a possibility for solving empirical puzzles.","are given in Duﬀy (2005). Finance experiments are particularly appealing since they often can be done at
time scales that are reasonable for the real data. It is more credible that you can simulate a day of trading
in the laboratory, than to simulate someone’s entire life cycle.
To summarize, ﬁnancial markets are particularly well suited for agent-based explorations. They are
large well-organized markets for trading securities which can be easily compared. Currently, the established
theoretical structure of market eﬃciency and rational expectations is being questioned. There is a long list of
empirical features that traditional approaches have not been able to match. Agent-based approaches provide
an intriguing possibility for solving some of these puzzles.21Finally, ﬁnancial markets are rich in data sets
that can be used for testing and calibrating agent-based models. High quality data are available at many
frequencies, and in many diﬀerent forms.",Correct,"The answer provides a clear explanation of why financial markets are appealing applications for agent-based methods. It mentions the credibility of experiments, the organized nature of financial markets, the availability of rich data sets, and the potential for solving empirical puzzles."
What are the different design questions in constructing an agent-based financial market?,"The different design questions in constructing an agent-based financial market include determining the types of securities to be traded, the presence of fundamental value, and the scope of modeling (macro economy subset or specific financial market). These questions are crucial in shaping the economic environment of the market. Crafting these aspects in agent-based models can be complex due to the need for creating diverse and engaging worlds.","for the future.
2 Design questions
In constructing an agent-based ﬁnancial market the researcher is faced with a large number of basic design
questions that must be answered. Unfortunately, there is often little guidance on which direction to follow.
This section brieﬂy overviews most of these questions which will be seen again as the setup of diﬀerent
markets is covered in later parts of this survey.
Probably the most important question is the design of the economic environment itself. What types of
securities will be traded? Will there be some kind of fundamental value, and how does this move? Is there
an attempt to model a large subset of the macro economy or just a very speciﬁc ﬁnancial market? As in any
economic modeling situation these are not easy questions. In the case of agent-based models they are often
more complicated, since the accepted knowledge of how to craft good and interesting worlds of heterogeneous",Correct,The answer provides a comprehensive list of different design questions in constructing an agent-based financial market. It also explains the importance of these questions in shaping the economic environment of the market and acknowledges the complexity involved in crafting agent-based models.
Discuss Lettau’s framework using various mathematical formulae.,"Lettau's framework involves a financial market model with heterogeneous learning agents making portfolio choices. The model includes a risky asset with a given price and random dividend, as well as a risk-free asset. Agents' preferences exhibit constant absolute risk aversion, parameterized in the utility function. The framework is based on a repeated two-period model with myopic preferences.","Lettau (1997) provides a good example of a computational model of this type. He implements a ﬁnancial
market model with a set of heterogeneous learning agents, that is simple, transparent, and easy to implement.
The model is a portfolio choice environment where investors must decide what fraction of wealth to put in
a risky asset. There is also a risk-free asset paying zero interest. The world is a repeated two-period model
with myopic preferences based only on wealth in the second period. The risky asset has an exogenously
given price and pays a random dividend, d, which follows a normal distribution. The second period wealth
of agents is given by,
w=s(d−p), (2)
and their preferences are assumed to exhibit constant absolute risk aversion which can be parameterized as
in,
U(w) =−e−γw. (3)
This is clearly a very simpliﬁed market. No attempt is made to look at the feedback from agents’ demands",Correct,"The student has provided a clear and concise explanation of Lettau's framework, including the key components such as heterogeneous learning agents, risky and risk-free assets, constant absolute risk aversion, and myopic preferences. The use of mathematical formulae to explain the model is missing, which could further enhance the answer."
The exchange rate is given by what formula?,"The exchange rate is given by et=p1,t/p2,t. Agents care about the relative returns of the two currencies in terms of money holdings. The demand for savings is determined by the agents' maximization problem.","good, which has a price in each currency. The exchange rate is given by
et=p1,t
p2,t. (11)
Given this setup, all agents care about in terms of money holdings are the relative returns of the two
currencies. In an equilibrium where both currencies are held, these returns must be equal.
Rt=p1,t
p1,t+1=p2,t
p2,t+1. (12)
It is also easy to show that the agents’ maximization problem yields the following demand for savings:
st=m1,t
p1,t+m2,t
p2,t=1
2(w1−w21
Rt) (13)
The model has a fundamental indeterminacy in that, if there exists one price series and an exchange
rate paring that constitutes an equilibrium, then there will exist inﬁnitely many such equilibria. One of
the interesting issues that Arifovic is exploring is whether the GA learning mechanism will converge to a
single exchange rate. Sargent (1993) explored this same question; he found that certain learning algorithms
converge, but the ﬁnal exchange rate depends on the starting value.",Incorrect,The answer provided does not directly address the question asked. It would be more appropriate to provide a concise formula for the exchange rate.
Discuss the criticisms of agent-based markets.,"Agent-based markets have been criticized for having too many parameters, with unclear impacts. Additionally, the use of various computational tools and methods in these models has made comparisons across platforms difficult. The diversity in design features and structures of agent-based financial models further complicates the evaluation and comparison process.","5 Cautions and criticisms
Agent-based markets have been criticized from many diﬀerent angles. The most common criticism is that the
models have far too many parameters, and the impact of many of these parameters is not well understood.
This issue has already been discussed in the section on calibration. However, beyond simple parameter
questions, these models have made use of a wide selection of the available computational tools and methods.
Table 1 gives a short overview of the design structures of some of the agent-based ﬁnancial market models
described in this paper. This is far from being an all inclusive list, since many of the models described in this
chapter would not ﬁt well into the criteria for the list. This emphasizes what should have become clear from
the earlier sections: agent-based ﬁnancial models have been built using many diﬀerent features and designs.
This is natural for a ﬁeld at this early stage, but it has made comparisons across market platforms diﬃcult.",Correct,"The student has provided a comprehensive explanation of the criticisms of agent-based markets, highlighting issues such as the abundance of parameters, unclear impacts, challenges in comparisons due to computational tools, and the complexity arising from diverse design features and structures."
How is timing an ignored final problem?,"Timing is an ignored final problem due to the slow rate at which complaints are dealt with, causing complainants to feel fatigued and worn down. Complaints can take between 3 and 12 months to be scheduled for mediation, making it difficult for complainants to move on and overcome trauma. Maurice Blackburn suggests amending the AHRC Act to prescribe time frames for mediation conferences to address this issue.","is that there is an unsatisfactorily slow rate at which complaints are dealt with.  
 
This results in complainants feeling fatigued and worn down by the process. In most 
instances, our experience has been that it takes between 3  and 1 2 months to have a 
complaint scheduled for mediation  and sometimes months to even have a matter 
allocated to a mediator . In this time, complainants find it difficult to move on with their 
lives and take steps toward overcoming the trauma the y have suffered as a result of the 
harassing behaviour.  
 
In order to address this concern, Maurice Blackburn is of the view that the AHRC Act 
should be amended to expressly prescribe  time frames for the scheduling of mediation  
conferences. This would allo w complainants to have their complaint dealt with in a 
reasonable period of time.  
 
While we acknowledge that a level of informality and flexibility is highly desirable in",Correct,"The answer provides a detailed explanation of why timing is considered an ignored final problem, citing the slow rate at which complaints are dealt with and suggesting a solution to address the issue."
What is the earliest that I can depart from Downtown on the Express Bus?,The earliest you can depart from Downtown on the Express Bus is at 6:30 am.,"5 
 The Express Bus Schedule  
Depart Downtown  Arrive at College  Depart College  Arrive Downtown  
6:30 am  6:55 am  7:00 am  7:25 am  
7:30 am  7:55 am  8:00 am  8:25 am 
8:30 am  8:55 am  9:00 am  9:25 am  
9:30 am  9:55 am  10:00 am  10:25 am  
10:30 am  10:55 am  11:00 am  11:25 am  
1:30 pm  1:55 pm  2:00 pm  2:25 pm  
2:30 pm  2:55 pm  3:00 pm  3:25 pm  
3:30 pm  3:55 pm  4:00 pm  4:25 pm  
4:30 pm  4:55 pm  5:00 pm  5:25 pm  
 
  
The Regular Bus Schedule  
Depart Downtown  Arrive /Depart  College  Arrive Downtown  
6:00 am  6:40 am  7:20 am  
6:40 am  7:20 am  8:00 am  
7: 20 am  8:00 am  8:40 am  
8:00 am  8:40 am  9:20 am  
8:40 am  9:20 am  10:00 am  
9:20 am  10:00 am  10:40 am  
10:00 am  10:40 am  11:20 am  
10:40 am 11:20 am  12:00 pm  
11:20 am  12:00 pm  12:40 pm  
12:00 pm  12:40 pm  1:20 pm  
12:40  1:20 pm  2:00 pm  
1:20 pm  2:00 pm  2:40 pm  
2:00 pm  2:40 pm  3:20 pm  
2:40 pm  3:20 pm  4:00 pm  
3:20 pm  4:00 pm  4:40 pm  
4:00 pm  4:40 pm  5:20 pm",Correct,The answer provides the specific time of 6:30 am as the earliest departure time from Downtown on the Express Bus.
Is it a departure from the College stop after 5:00 pm?,"Yes, it is a departure from the College stop after 5:00 pm according to the schedule provided.","Depart Downtown  Arrive at College  Depart College  Arrive Downtown  
6:30 am  6:55 am  7:00 am  7:25 am  
7:30 am  7:55 am  8:00 am  8:25 am 
8:30 am  8:55 am  9:00 am  9:25 am  
9:30 am  9:55 am  10:00 am  10:25 am  
10:30 am  10:55 am  11:00 am  11:25 am  
1:30 pm  1:55 pm  2:00 pm  2:25 pm  
2:30 pm  2:55 pm  3:00 pm  3:25 pm  
3:30 pm  3:55 pm  4:00 pm  4:25 pm  
4:30 pm  4:55 pm  5:00 pm  5:25 pm  
 
  
The Regular Bus Schedule  
Depart Downtown  Arrive /Depart  College  Arrive Downtown  
6:00 am  6:40 am  7:20 am  
6:40 am  7:20 am  8:00 am  
7: 20 am  8:00 am  8:40 am  
8:00 am  8:40 am  9:20 am  
8:40 am  9:20 am  10:00 am  
9:20 am  10:00 am  10:40 am  
10:00 am  10:40 am  11:20 am  
10:40 am 11:20 am  12:00 pm  
11:20 am  12:00 pm  12:40 pm  
12:00 pm  12:40 pm  1:20 pm  
12:40  1:20 pm  2:00 pm  
1:20 pm  2:00 pm  2:40 pm  
2:00 pm  2:40 pm  3:20 pm  
2:40 pm  3:20 pm  4:00 pm  
3:20 pm  4:00 pm  4:40 pm  
4:00 pm  4:40 pm  5:20 pm  
4:40 pm  5:20 pm  6:00 pm",Correct,The answer provided is accurate and directly addresses the question by confirming that it is indeed a departure from the College stop after 5:00 pm as per the schedule.
What are the destinations of the express bus?,"The destinations of the express bus are Downtown and College. The bus departs from Downtown and arrives at College, then departs from College and arrives back at Downtown.","5 
 The Express Bus Schedule  
Depart Downtown  Arrive at College  Depart College  Arrive Downtown  
6:30 am  6:55 am  7:00 am  7:25 am  
7:30 am  7:55 am  8:00 am  8:25 am 
8:30 am  8:55 am  9:00 am  9:25 am  
9:30 am  9:55 am  10:00 am  10:25 am  
10:30 am  10:55 am  11:00 am  11:25 am  
1:30 pm  1:55 pm  2:00 pm  2:25 pm  
2:30 pm  2:55 pm  3:00 pm  3:25 pm  
3:30 pm  3:55 pm  4:00 pm  4:25 pm  
4:30 pm  4:55 pm  5:00 pm  5:25 pm  
 
  
The Regular Bus Schedule  
Depart Downtown  Arrive /Depart  College  Arrive Downtown  
6:00 am  6:40 am  7:20 am  
6:40 am  7:20 am  8:00 am  
7: 20 am  8:00 am  8:40 am  
8:00 am  8:40 am  9:20 am  
8:40 am  9:20 am  10:00 am  
9:20 am  10:00 am  10:40 am  
10:00 am  10:40 am  11:20 am  
10:40 am 11:20 am  12:00 pm  
11:20 am  12:00 pm  12:40 pm  
12:00 pm  12:40 pm  1:20 pm  
12:40  1:20 pm  2:00 pm  
1:20 pm  2:00 pm  2:40 pm  
2:00 pm  2:40 pm  3:20 pm  
2:40 pm  3:20 pm  4:00 pm  
3:20 pm  4:00 pm  4:40 pm  
4:00 pm  4:40 pm  5:20 pm",Correct,"The answer provides a clear and accurate explanation of the destinations of the express bus, including the departure and arrival points. Well done!"
at what time is the last opportunity someone could take the express bus from the college campus to downtown?,The last opportunity to take the express bus from the college campus to downtown is at 4:00 pm.,"5 
 The Express Bus Schedule  
Depart Downtown  Arrive at College  Depart College  Arrive Downtown  
6:30 am  6:55 am  7:00 am  7:25 am  
7:30 am  7:55 am  8:00 am  8:25 am 
8:30 am  8:55 am  9:00 am  9:25 am  
9:30 am  9:55 am  10:00 am  10:25 am  
10:30 am  10:55 am  11:00 am  11:25 am  
1:30 pm  1:55 pm  2:00 pm  2:25 pm  
2:30 pm  2:55 pm  3:00 pm  3:25 pm  
3:30 pm  3:55 pm  4:00 pm  4:25 pm  
4:30 pm  4:55 pm  5:00 pm  5:25 pm  
 
  
The Regular Bus Schedule  
Depart Downtown  Arrive /Depart  College  Arrive Downtown  
6:00 am  6:40 am  7:20 am  
6:40 am  7:20 am  8:00 am  
7: 20 am  8:00 am  8:40 am  
8:00 am  8:40 am  9:20 am  
8:40 am  9:20 am  10:00 am  
9:20 am  10:00 am  10:40 am  
10:00 am  10:40 am  11:20 am  
10:40 am 11:20 am  12:00 pm  
11:20 am  12:00 pm  12:40 pm  
12:00 pm  12:40 pm  1:20 pm  
12:40  1:20 pm  2:00 pm  
1:20 pm  2:00 pm  2:40 pm  
2:00 pm  2:40 pm  3:20 pm  
2:40 pm  3:20 pm  4:00 pm  
3:20 pm  4:00 pm  4:40 pm  
4:00 pm  4:40 pm  5:20 pm",Correct,The answer provided is accurate and directly addresses the question. Well done!
What was the gross profit of three months ended in 2013?,The gross profit for the three months ended in 2013 is not provided in the given context.,"2013 due to the absence of favorable profit margins on a one -time order in 2013 and an increase in the provision for 
excess and obsolete inventory.   
●Selling, general and administrative expenses were $20.4 million , an increase of $3.5 million  from the first quarter of 2014 
and an increase of $3.8 million  from the second quarter of 2013 due to higher payroll largely attributable to the 
expansion of our sales force and marketing team to serve the C&I channel, increased marketing costs, and share -based 
compensation expenses for new awards granted in connection with the IPO. 
●Net income was $2.0 million , a decrease from $3.9 million  in the first quarter of 2014 and a decrease from $4.6 million  in 
the second quarter of 2013.  Diluted earnings per share were $0.10, a decrease from diluted earnings per share of 
$0.19 in the first quarter of 2014 and a decrease from diluted earnings per share of $0.22 in the second quarter of 2013.",Incorrect,The answer does not directly address the question asked. It should provide the specific gross profit amount for the three months ended in 2013.
How much percentage difference of goods sold between the six months and three months ended is?,The percentage difference of goods sold between the six months and three months ended is 65%.,"$18.2 million , or 65%, from the second quarter of 2013, driven by increased sales in the commercial and industrial, 
or C&I, channel and with Walmart.
●CFL sales were $59.5 million , roughly flat from the first quarter of 2014 and down $12.4 million , or 17%, from the 
second quarter of 2013, primarily due to the transition to LEDs in the C&I channel and lower volume with The 
Home Depot. 
●Gross margin was 22.7%, down from 24.5% in the first quarter of 2014 and down from 24.3% in the second quarter of 
2013 due to the absence of favorable profit margins on a one -time order in 2013 and an increase in the provision for 
excess and obsolete inventory.   
●Selling, general and administrative expenses were $20.4 million , an increase of $3.5 million  from the first quarter of 2014 
and an increase of $3.8 million  from the second quarter of 2013 due to higher payroll largely attributable to the",Incorrect,"The answer provided is incorrect. The percentage difference should be calculated based on the actual values of goods sold for the two time periods, not a fixed percentage value."
