question,answer,context,grade,eval_description
The participating schools of the Traffic Bowl Competition were from what all states in the US?,"The participating schools in the Traffic Bowl Competition were from Oregon, Idaho, and Washington. The schools included Portland State University, University of Idaho, University of Portland, Oregon State University, University of Washington, and Oregon Institute of Technology.","Oregon Section 2007/2008 Annual Report  
Institute of Transportation Engineers  Page 10 of 1 3 7.  STUDENT CHAPTER ACTIVITIES 
The Student Liaison Committee had another successful year in attracting schools from the Pacific 
Northwest to compete in the Oregon Section's annual Traffic Bowl Competition. The Traffic Bowl is 
a Jeopardy-based trivia contest where students must answer ques tions on a variety of traffic and 
transportation trivia. This year the competition was held on Novem ber 15, 2007 at McMenamin's 
Edgefield just east of Portland, Oregon.  
This year we had 52 students from six universities attending the event. Par ticipating schools were: 
/square4 Portland State University 
/square4 University of Idaho 
/square4 University of Portland 
/square4 Oregon State University 
/square4 University of Washington 
/square4 Oregon Institute of Technology 
 
University of Portland took home the grand prize of bragging rights , a trophy and a $400 scholarship",Correct,"The answer provides a clear and accurate list of states from which the participating schools in the Traffic Bowl Competition were from. Additionally, it also mentions specific universities from these states that participated in the competition."
How do you think the donations from the local companies help in offseting the cost of the student meals and scholarships in the competition?,"Donations from local companies help offset the cost of student meals and scholarships by providing financial support for student attendance at the competition. Companies like Advanced Traffic Products, CH2M Hill, and others contributed funds to support the students. This assistance allows more students to participate and benefit from the event.","/square4 University of Washington 
/square4 Oregon Institute of Technology 
 
University of Portland took home the grand prize of bragging rights , a trophy and a $400 scholarship 
award. University of Washington and Oregon Institute of Technology  both received $300 for tying 
for second place.  The remaining three participating schools rec eived a $150 participation award.  All 
of the student attendees received a free dinner at this ev ent. In order to offset the cost of the student 
meals and scholarships, several local companies donated funds to  support student attendance. 
Donations were received from: Advanced Traffic Products, CH2M Hil l, City of Gresham, City of 
Portland, Coral Sales Company, David Evans and Associates, DKS As sociates, Group Mackenzie, 
HDR, IBI Group, JRH Engineering, Kittelson and Associates, Lancaste r Engineering, NWS Traffic 
Engineering, Parametrix, Quality Counts, TrafStats, URS Corp, W&H Pacific, and Western Systems.",Correct,The answer provides a clear explanation of how donations from local companies help offset the cost of student meals and scholarships in the competition. It mentions specific companies that have contributed funds and how this financial support allows more students to participate and benefit from the event.
Discuss the Oregon Section's website.,"The Oregon Section's website, www.oregonite.org, was dynamic and modified to meet the changing needs of the Section. It included information on meetings, activities, officer contact details, conferences, job listings, and section news. Online registration for meetings was popular and effective for members.","Oregon Section 2007/2008 Annual Report  
Institute of Transportation Engineers  Page 11 of 1 3 8.  OTHER ACTIVITIES  
Webmaster Report : 
This year the Oregon Section retained the domain na me, www.oregonite.org . The website remained very 
dynamic and was modified significantly to reflect t he changing needs of the Section. The web page incl udes 
information about meetings, activities, officer con tact information, upcoming conferences, available j obs, 
and section news. The site always has the current a nd upcoming meeting information posted, and on-line  
registration for Section meetings continued to be b oth popular and successful.  In addition, electroni c 
download of the registration information were used to produce the registration list, name badges and w ritten 
receipts for any specific event. This form of regis tration has proven to be very effective and user fr iendly for 
members. 
 
Annual Golf Tournament:",Correct,"The answer provides a detailed and informative description of the Oregon Section's website, highlighting its dynamic nature and the various information available on it. The mention of online registration for meetings shows an understanding of the website's functionality."
What do you know about the 18th annual ITE Golf Tournament?,"The 18th annual ITE Golf Tournament was hosted by the Oregon Section at Quail Valley Golf Course on September 21, 2007. The tournament drew 57 competitors from across the state and was held at the Oregon Golf Association in Woodburn, Oregon. The event had good turnout, exceeding last year's attendance, and was sponsored by various companies.","receipts for any specific event. This form of regis tration has proven to be very effective and user fr iendly for 
members. 
 
Annual Golf Tournament:                           
The Oregon Section hosted its 18th annual ITE Golf Tournament at Quail Valley Golf Course on 
September 21, 2007. The tournament drew 57 competitors fro m across the state. The golf event was held at 
Oregon Golf Association (OGA) in Woodburn, Oregon.  This location is approximately 30 miles south of 
Portland. Turnout was good, exceeding last year’s a ttendance, and it was a fun and entertaining event.  In 
addition to volunteers, Lancaster Engineering, Davi d Evans & Associates, DKS Associates, Quality 
Counts, Parsons Brinkerhoff, Inc., Kittelson & Asso ciates, Inc., All Traffic Data Services, TrafStats,  
Western Systems and NW Signal sponsored the event. 
 
Speaker Appreciation Gifts: 
It is the Oregon Section’s tradition to recognize the speaker a t the Monthly Section Meetings and",Correct,"The answer provides detailed information about the 18th annual ITE Golf Tournament including the host, location, date, number of competitors, venue, turnout, and sponsors. It is well-written and covers all the key points."
What are the standard rules of a golf game?,I don't know.,"Portland, this year’s golf tournament was held in 
late summer.  We had good turn out and good 
corporate sponsorship donations.  Oregon Golf 
Association 
(OGA) Golf 
Course, 
Woodburn, OR  57 
9-25-07 September 
Meeting  Jim Peters (DKS Associates) and Jay McCoy (City 
of Gresham) gave a presentation on the use of recen t 
SCATS Adaptive Traffic Signal System in City of 
Gresham, Oregon.   Kells Irish Pub 
Portland, OR 56 
10-23-07 October 
Meeting Senator Rick Metsger, Chairman of the Senate 
Transportation Committee, discussed about 
congestion pricing and his “Moving Oregon” 
statewide transportation tour, and effort to build 
support for major investment in Oregon’s 
transportation system. Hotel Monaco, 
Portland, OR 73 
11-15-07 2007 Student 
Traffic Bowl Oregon ITE 16 th  Annual Student Traffic Bowl 
competition featured six universities from around 
the northwest.  This year’s 1 st  place prize went to 
University of Portland, while University of",Incorrect,The answer provided does not demonstrate knowledge of the standard rules of a golf game. It is important to review the rules and provide a more accurate response next time.
How do you think the token gifts motivate the speakers?,"The token gifts, such as USB thumb drives and handmade coffee mugs, serve as a gesture of appreciation for the speakers. These gifts can motivate the speakers by recognizing their contribution to the event and making them feel valued by the sponsors. The act of presenting token gifts can also encourage speakers to continue participating in future events.","Western Systems and NW Signal sponsored the event. 
 
Speaker Appreciation Gifts: 
It is the Oregon Section’s tradition to recognize the speaker a t the Monthly Section Meetings and 
various other guests of the Section by presenting them with a token gift. USB thumb drives printed 
with an Oregon ITE logo were purchased as speaker gifts this year, as were handmade coffee mugs 
with the Oregon ITE logo. 
 
District 6 Meeting - Local Arrangements Committee: 
The Oregon Section helped arrange the 2007 District 6 (now Western District) m eeting that was held 
July 15 to 18 in Portland.  This meeting was combined with the Quad Conference to expand  the reach 
of this event to our friends in Vancouver, BC. The Quad meeting was originally s cheduled to take 
place in 2008 in Portland, but the Oregon Section swapped meeting years with the  Vancouver Island 
Section in order to better coordinate the district and quad meetings (a w in-win situation for both 
Sections).",Correct,"The answer provides a clear explanation of how token gifts motivate the speakers by recognizing their contribution, making them feel valued, and encouraging future participation."
How was the District 6 meeting a huge success?,"The District 6 meeting was a huge success due to the high attendance of over 500 people. The committee, led by Peter Koonce, organized a successful technical and social event for the members. The meeting included various highlights such as exam offerings, student competitions, technical sessions, and poster sessions.","Section in order to better coordinate the district and quad meetings (a w in-win situation for both 
Sections). 
The District 6 meeting was a huge success in that it attracted over 500 at tendees. The committee, 
chaired by Peter Koonce, was responsible for setting up a great techni cal and social event for the 
members of District 6. Some of the highlights include: 
/crosstar2 PTOE/PTP/TSOS/TOPS Exam Offering 
/crosstar2 James H. Kell Student Competition 
/crosstar2 36 Technical Sessions 
/crosstar2 2 Poster Sessions",Correct,"The answer provides specific details about the District 6 meeting, highlighting the high attendance, successful organization by Peter Koonce, and various activities conducted during the meeting."
Which award was granted over the past year? To whom was it given?,The Traffic Bowl - First Place Award was granted over the past year. It was given to the University of Portland to encourage student participation in the Oregon Section ITE.,"Oregon Section 2007/2008 Annual Report  
Institute of Transportation Engineers  Page 13 of 1 3  
9.   AWARDS                             
 
The Oregon Section recognized several groups and individuals during 2007-08. The Section provided 
over $1,450 in awards to various ITE Student Sections throughout the gr eater Northwest. The awards 
granted over the past year are summarized below. 
 
Award Name: Traffic Bowl - First Place Award   
Recipient's Name:  University of Portland 
Purpose of Award:  To Encourage Student Participation in Oregon Section ITE 
Form of Award:  $400 to Student Chapter",Correct,The answer provides a clear and accurate response to the question by identifying the award (Traffic Bowl - First Place Award) and who it was given to (University of Portland). The additional information about encouraging student participation in the Oregon Section ITE is also relevant.
How do you think sexual harassment as an issue is peculiar to Australian workplaces?,Sexual harassment in Australian workplaces persists despite legislation prohibiting it since 1984. The current legislative scheme places the burden on victims to seek redress rather than on employers to prevent harassment. Maurice Blackburn Lawyers believe that a positive obligation on employers to prevent harm would be more effective.,"Maurice Blackburn Lawyers submission to the National Inquiry into Sexual Harassment in Australian Workplaces . 
Page 7 
  
i. Positive obligation on employers  
 
Sexual harassment in the workplace has been prohibited in Australia since the passing of the 
Sex Discrimination Act 1984  (Cth) (‘ SDA ’). However, the persistent prevalence of sexual 
harassment within Australian workplaces since that time suggests that the current legislation 
has failed in preventing this kind of conduct.  
 
Maurice Blackburn is of the view that one of the significant failings of the current legislative 
scheme is the onus it places on victims to seek redress for the harm they have suffered, 
rather than placing a positive obligation on employers to prevent the harm occurring in the 
first instance.   
 
The current legislative scheme requires victims of sexual harassment to take the step of 
making a complaint before they are able to pursue a remedy in relation to the unlawful",Correct,"The answer provides a detailed explanation of how sexual harassment is peculiar to Australian workplaces, mentioning the legislation, burden on victims, and the suggestion for a more effective approach."
What legislative suggestions pertaining to workplace sexual harassment does the firm provide in its submission?,"The firm suggests implementing a positive duty on employers to take reasonable and proportionate measures to eliminate sexual harassment in the workplace. They also recommend introducing a statutory definition of sexual harassment to provide clarity and consistency in understanding and addressing the issue. Additionally, the firm proposes establishing a new independent statutory body to oversee compliance with workplace sexual harassment laws.","Submission in Response 
to the National Inquiry into 
Sexual Harassment in 
Australian Workplaces  
 
 
February 2019",Correct,"The answer provides a detailed explanation of the legislative suggestions pertaining to workplace sexual harassment provided by the firm. It covers the implementation of a positive duty on employers, the introduction of a statutory definition of sexual harassment, and the proposal for a new independent statutory body to oversee compliance with workplace sexual harassment laws."
How does the scarcity of data on mediations impact the efficacy of the Complaints Process?,"The scarcity of data on mediations impacts the efficacy of the Complaints Process by limiting the ability to assess its effectiveness. Without sufficient data, it is challenging to make informed decisions and improvements to the process. Proper funding and staffing of the AHRC are crucial to address this issue.","that statutory caps on damages under state legislation should be abolished to reflect the 
federal jurisdiction.  
 
vi. The Complaints Process  
 
In addition to the limitations of the statu tory framework set out above, from our experience, 
the Individual Complaints System itself can be ineffective at achieving a just result for 
complainants.  
 
Our primary and overriding submission in relation to the Individual Complaints System is that 
it is paramount that the AHRC be properly funded and fully staffed in order to fulfil its 
statutory objectives.  
 
Below we have identified three additional issues which impact the efficacy of the Complaints 
Process. They are related to:  
 
 Scarcity of data on med iations;  
 Employer tactics ; and  
 The mediation process  
 
These are discussed in more detail below:  
 
Scarcity of Data  on Mediations  
 
It should be noted that there have been very few Australian studies which have examined",Correct,"The answer provides a clear explanation of how the scarcity of data on mediations impacts the efficacy of the Complaints Process. It highlights the importance of sufficient data for assessing effectiveness and making informed decisions. Additionally, it suggests a solution by emphasizing the need for proper funding and staffing of the AHRC."
What and why the firm designates as one of the significant failings of the current legislative scheme?,One of the significant failings of the current legislative scheme is placing the onus on victims to seek redress rather than obligating employers to prevent harm. Maurice Blackburn believes there should be enforceable sanctions against employers who fail to provide a safe workplace. They also advocate for organizations to report incidents of sexual harassment to the Workplace Gender Equality Agency.,"available to victims.  
 
The impacts on victims can be life long and life changing.  
 
Maurice Blackburn is of the view that one of the signif icant failings of the current legislative 
scheme is the onus it places on victims to seek redress for the harm they have suffered, 
rather than placing a positive obligation on employers to prevent the harm occurring in the 
first instance. We believe there should be enforceable sanctions against employers who fail 
in their duty to provide a safe workplace for their employees.  
 
We believe that it is important that the governing bodies of all organisations should be fully 
aware of the incidence of sexual haras sment in their workplace, and that they should be 
required to report on the number of reported incidents of sexual harassment, as part of their 
reporting requirements to Workplace Gender Equality Agency (‘WGEA’).  
 
We believe that the current legislated tim eframe for making a complaint through AHRC is",Correct,"The answer provides a clear explanation of one significant failing of the current legislative scheme, which is placing the responsibility on victims instead of employers. It also mentions Maurice Blackburn's stance on enforceable sanctions and reporting incidents of sexual harassment to the Workplace Gender Equality Agency."
In what cases should online sexual harassment be criminalized according to the submission?,Online sexual harassment should be criminalized when it involves particularly nefarious behaviors that harm victims and survivors. A legislative framework should incorporate regulation and criminal sanctions to hold abusers accountable. Providing resources to police and regulatory services is essential for successfully prosecuting individuals engaging in sexual harassment online.," The perception that ‘the rules are different on -line’. Threats or harassment made on -
line seem to be held to a different standard of accountability than if they were made 
via any other mechanism. Some of the current academic work around ‘online 
disinhibiti on’ is worthy of exploration.  
 
We have long argued that a legislative framework is needed which incorporates:  
 
 Regulation and criminal sanctions holding the behaviours of abusers, employers and 
carriage services to account, and  
 
 A civil regime through which victims and survivors of online abuse can access legal 
tools to allow them to seek relief and damages.  
 
This will necessitate criminalising particularly nefarious behaviours, and then providing the 
relevant police and regulatory services with the res ources to successfully prosecute people 
engaging in sexual harassment through on -line platforms.  
 
We believe that, for this to have the required deterrent effect, it is important that all those who",Correct,"The answer provides a clear explanation of when online sexual harassment should be criminalized, mentioning nefarious behaviors that harm victims, the need for a legislative framework with regulation and criminal sanctions, and the importance of providing resources to police and regulatory services for successful prosecution."
