question,answer,context,grade,eval_description
In which year were there the greatest total assets?,"The greatest total assets were in the year 2014 with a total of $355,866.","2014 2013
Assets
Current assets:
Cash and cash equivalents $    16,091 $    21,903
Restricted cash 6,666 3,404
Accounts receivable, less allowance for doubtful accounts of $1,416 and
82,634 59,574     $1,479 at June 30, 2014  and December 31, 2013 , respectively
Inventories 116,872 119,477
Prepaids and other current assets 18,826 14,415
Deferred income taxes 9,030 10,551
Total current assets 250,119 229,324
Property, plant and equipment, net of accumulated depreciation of $39,965 and
70,924 74,558    $39,007 at June 30, 2014  and December 31, 2013  respectively
Land rights, net 4,154 4,244
Deferred costs 18,364 18,732
Finance receivables from related parties — 1,915
Intangible assets, net of accumulated amortization of $861 and $837 at June 30,
2,826 2,993    2014 and December 31, 2013 , respectively
Deferred income taxes, long -term 7,772 7,758
Other long -term assets 1,707 1,741
Total assets $   355,866 $   341,265
Liabilities and Shareholders' Equity
Current liabilities:",Correct,"The answer provides the correct information by stating that the greatest total assets were in the year 2014 with a total of $355,866."
In which year were there the greatest total liabilities?,The greatest total liabilities were in the year 2014.,"2,826 2,993    2014 and December 31, 2013 , respectively
Deferred income taxes, long -term 7,772 7,758
Other long -term assets 1,707 1,741
Total assets $   355,866 $   341,265
Liabilities and Shareholders' Equity
Current liabilities:
Short-term loans and current portion of long -term debt $   138,711 $   122,840
Accounts payable 103,835 105,742
Accrued expenses and other current liabilities 59,208 62,539
Total current liabilities 301,754 291,121
Long-term debt, net of current portion  5,442 7,553
Income taxes payable, long -term 7,410 7,043
Legal settlements, net of current portion 31,232 30,941
Other long -term liabilities  512 427
Total liabilities 346,350 337,085
Commitments and contingencies
Shareholders' equity:
Common stock, CHF 1.00 par value; 41,107 shares authorized; 20,553
22,048 22,048    issued and outstanding at June 30, 2014  and December 31 , 2013 
Additional paid -in capital 2,553 901
Accumulated other comprehensive income 13,237 13,721",Correct,The answer provided is accurate and directly addresses the question asked. Well done!
How varied were the subjects of the different Oregon section meetings?,"The subjects of the different Oregon section meetings varied, including presentations on the Columbia River Crossing project and Highway 25 emergency reconstruction efforts. The meetings covered topics related to transportation and traffic control devices, with joint meetings with other professional societies. The subjects ranged from specific projects to broader industry-related discussions.","The Oregon Section conducted six (6) general meetings and the sum mer golf tournament over the 
past year, as well as hosting Joint 2007 ITE District 6 annual me eting. The general meetings included 
luncheons with speakers, joint-meetings with other professional s ocieties, the annual traffic bowl, and 
a technical workshop. The table below summarizes the general meet ings conducted over the past year 
and those scheduled for the remainder of 2008.   
SOREGON SECTION MEETINGS 
Date Meeting Subject Location Attendees 
4-10-07 April - Joint 
meeting with 
WTS Kris Strickler and Danielle Cogan gave a 
presentation on the Columbia River Crossing 
project on the I-5 bridge that connects Oregon 
and Washington. Embassy Suites 
Hotel 
Portland, OR 60 
5-18-07 May - Joint 
meeting with 
Oregon Traffic 
Control Devices 
Committee 
(OTCDC) Sections newly elected officers were announced 
and a presentation on the Highway 25 emergency 
reconstruction efforts that followed a large storm",Correct,"The answer provides a detailed explanation of the varied subjects discussed in the Oregon section meetings, including specific examples such as the Columbia River Crossing project and Highway 25 emergency reconstruction efforts. It also mentions the range of topics covered, from specific projects to broader industry-related discussions."
What is the Oregon Section's annual Traffic Bowl Competition?,"The Oregon Section's annual Traffic Bowl Competition is a Jeopardy-based trivia contest focused on traffic and transportation. The competition was held on November 15, 2007 at McMenamin's Edgefield near Portland, Oregon. University of Portland won the grand prize, with other universities receiving scholarship awards as well.","Northwest to compete in the Oregon Section's annual Traffic Bowl Competition. The Traffic Bowl is 
a Jeopardy-based trivia contest where students must answer ques tions on a variety of traffic and 
transportation trivia. This year the competition was held on Novem ber 15, 2007 at McMenamin's 
Edgefield just east of Portland, Oregon.  
This year we had 52 students from six universities attending the event. Par ticipating schools were: 
/square4 Portland State University 
/square4 University of Idaho 
/square4 University of Portland 
/square4 Oregon State University 
/square4 University of Washington 
/square4 Oregon Institute of Technology 
 
University of Portland took home the grand prize of bragging rights , a trophy and a $400 scholarship 
award. University of Washington and Oregon Institute of Technology  both received $300 for tying 
for second place.  The remaining three participating schools rec eived a $150 participation award.  All",Correct,"The answer provides a detailed explanation of the Oregon Section's annual Traffic Bowl Competition, including the format, location, date, and the outcome of the competition. Well done."
The participating schools of the Traffic Bowl Competition were from what all states in the US?,"The participating schools in the Traffic Bowl Competition were from Oregon, Washington, Idaho, and the Pacific Northwest region.","The Student Liaison Committee had another successful year in attracting schools from the Pacific 
Northwest to compete in the Oregon Section's annual Traffic Bowl Competition. The Traffic Bowl is 
a Jeopardy-based trivia contest where students must answer ques tions on a variety of traffic and 
transportation trivia. This year the competition was held on Novem ber 15, 2007 at McMenamin's 
Edgefield just east of Portland, Oregon.  
This year we had 52 students from six universities attending the event. Par ticipating schools were: 
/square4 Portland State University 
/square4 University of Idaho 
/square4 University of Portland 
/square4 Oregon State University 
/square4 University of Washington 
/square4 Oregon Institute of Technology 
 
University of Portland took home the grand prize of bragging rights , a trophy and a $400 scholarship 
award. University of Washington and Oregon Institute of Technology  both received $300 for tying",Correct,The answer provides a clear and accurate list of states from which the participating schools in the Traffic Bowl Competition were from. Well done.
How do you think the donations from the local companies help in offseting the cost of the student meals and scholarships in the competition?,"Donations from local companies help offset the cost of student meals and scholarships by providing financial support for student attendance at the competition. Companies like Advanced Traffic Products, CH2M Hill, and others contributed funds to support the students. This assistance allows more students to participate and benefit from the event.","/square4 University of Idaho 
/square4 University of Portland 
/square4 Oregon State University 
/square4 University of Washington 
/square4 Oregon Institute of Technology 
 
University of Portland took home the grand prize of bragging rights , a trophy and a $400 scholarship 
award. University of Washington and Oregon Institute of Technology  both received $300 for tying 
for second place.  The remaining three participating schools rec eived a $150 participation award.  All 
of the student attendees received a free dinner at this ev ent. In order to offset the cost of the student 
meals and scholarships, several local companies donated funds to  support student attendance. 
Donations were received from: Advanced Traffic Products, CH2M Hil l, City of Gresham, City of 
Portland, Coral Sales Company, David Evans and Associates, DKS As sociates, Group Mackenzie, 
HDR, IBI Group, JRH Engineering, Kittelson and Associates, Lancaste r Engineering, NWS Traffic",Correct,"The answer provides a clear explanation of how donations from local companies help offset the cost of student meals and scholarships in the competition. It also gives specific examples of companies that have contributed funds to support the students, demonstrating a good understanding of the topic."
Discuss the Oregon Section's website.,"The Oregon Section's website, www.oregonite.org, is dynamic and regularly updated to meet the Section's needs. It provides information on meetings, activities, officer contacts, conferences, jobs, and news. Online registration for meetings is popular and effective for members.","Webmaster Report : 
This year the Oregon Section retained the domain na me, www.oregonite.org . The website remained very 
dynamic and was modified significantly to reflect t he changing needs of the Section. The web page incl udes 
information about meetings, activities, officer con tact information, upcoming conferences, available j obs, 
and section news. The site always has the current a nd upcoming meeting information posted, and on-line  
registration for Section meetings continued to be b oth popular and successful.  In addition, electroni c 
download of the registration information were used to produce the registration list, name badges and w ritten 
receipts for any specific event. This form of regis tration has proven to be very effective and user fr iendly for 
members. 
 
Annual Golf Tournament:                           
The Oregon Section hosted its 18th annual ITE Golf Tournament at Quail Valley Golf Course on",Correct,"The answer provides a detailed description of the Oregon Section's website, highlighting its dynamic nature, regular updates, and the various information it offers to members. The mention of online registration for meetings shows an understanding of the website's functionality."
What do you know about the 18th annual ITE Golf Tournament?,"The 18th annual ITE Golf Tournament was hosted by the Oregon Section at Quail Valley Golf Course on September 21, 2007. The event drew 57 competitors from across the state and was held at the Oregon Golf Association in Woodburn, Oregon. The tournament had good turnout, exceeding the previous year's attendance, and was sponsored by various companies.","The Oregon Section hosted its 18th annual ITE Golf Tournament at Quail Valley Golf Course on 
September 21, 2007. The tournament drew 57 competitors fro m across the state. The golf event was held at 
Oregon Golf Association (OGA) in Woodburn, Oregon.  This location is approximately 30 miles south of 
Portland. Turnout was good, exceeding last year’s a ttendance, and it was a fun and entertaining event.  In 
addition to volunteers, Lancaster Engineering, Davi d Evans & Associates, DKS Associates, Quality 
Counts, Parsons Brinkerhoff, Inc., Kittelson & Asso ciates, Inc., All Traffic Data Services, TrafStats,  
Western Systems and NW Signal sponsored the event. 
 
Speaker Appreciation Gifts: 
It is the Oregon Section’s tradition to recognize the speaker a t the Monthly Section Meetings and 
various other guests of the Section by presenting them with a token gift. USB thumb drives printed 
with an Oregon ITE logo were purchased as speaker gifts this year, as were handmade coffee mugs",Incorrect,"The answer provides detailed information about the 18th annual ITE Golf Tournament, but it does not directly answer the question. The student should focus on summarizing key points about the tournament instead of providing a detailed description."
What are the standard rules of a golf game?,I don't know.,"A second important innovation is the use of a common pool of rules, which the authors refer to as a
“business school.” This allows for some strategy learning to occur across agents in a very natural way.38
The rules in the common pool are evolved according to forecast accuracy. Traders then decide to update
their own strategies based on current performance. They draw rules from the common pool, comparing their
performance with their current rules. If the new rule is better they switch, but if they are unsuccessful after
several tries, they quit and stay with their current rule.
Simulations of this ﬁnancial market display some features of actual return time series. They exhibit fat
tails, and visually they do not settle down to any price level. However, there are several features that disagree
with the actual data. For example, there is a large level of positive skew. Also, the linearly ﬁltered return",Incorrect,The answer provided does not address the question and shows lack of knowledge about the standard rules of a golf game.
How do you think the token gifts motivate the speakers?,"The token gifts, such as USB thumb drives and handmade coffee mugs, serve as a tradition to recognize speakers at the Oregon Section's events. These gifts are likely to motivate speakers by showing appreciation for their participation and contribution to the events. The sponsorship by Western Systems and NW Signal also adds to the motivation for speakers by providing support and recognition for their involvement.","Western Systems and NW Signal sponsored the event. 
 
Speaker Appreciation Gifts: 
It is the Oregon Section’s tradition to recognize the speaker a t the Monthly Section Meetings and 
various other guests of the Section by presenting them with a token gift. USB thumb drives printed 
with an Oregon ITE logo were purchased as speaker gifts this year, as were handmade coffee mugs 
with the Oregon ITE logo. 
 
District 6 Meeting - Local Arrangements Committee: 
The Oregon Section helped arrange the 2007 District 6 (now Western District) m eeting that was held 
July 15 to 18 in Portland.  This meeting was combined with the Quad Conference to expand  the reach 
of this event to our friends in Vancouver, BC. The Quad meeting was originally s cheduled to take 
place in 2008 in Portland, but the Oregon Section swapped meeting years with the  Vancouver Island 
Section in order to better coordinate the district and quad meetings (a w in-win situation for both 
Sections).",Correct,"The answer provides a clear explanation of how token gifts like USB thumb drives and handmade coffee mugs serve as a tradition to recognize speakers at the Oregon Section's events. It also mentions how these gifts can motivate speakers by showing appreciation for their participation and contribution. Additionally, the answer highlights the sponsorship by Western Systems and NW Signal, which further adds to the motivation for speakers by providing support and recognition for their involvement."
How was the District 6 meeting a huge success?,"The District 6 meeting was a huge success as it attracted over 500 attendees and offered a variety of technical and social events. The committee, chaired by Peter Koonce, did a great job in organizing the event. Some highlights included exam offerings, student competitions, technical sessions, and poster sessions.","District 6 Meeting - Local Arrangements Committee: 
The Oregon Section helped arrange the 2007 District 6 (now Western District) m eeting that was held 
July 15 to 18 in Portland.  This meeting was combined with the Quad Conference to expand  the reach 
of this event to our friends in Vancouver, BC. The Quad meeting was originally s cheduled to take 
place in 2008 in Portland, but the Oregon Section swapped meeting years with the  Vancouver Island 
Section in order to better coordinate the district and quad meetings (a w in-win situation for both 
Sections). 
The District 6 meeting was a huge success in that it attracted over 500 at tendees. The committee, 
chaired by Peter Koonce, was responsible for setting up a great techni cal and social event for the 
members of District 6. Some of the highlights include: 
/crosstar2 PTOE/PTP/TSOS/TOPS Exam Offering 
/crosstar2 James H. Kell Student Competition 
/crosstar2 36 Technical Sessions 
/crosstar2 2 Poster Sessions",Correct,"The answer provides specific details about the District 6 meeting, highlighting the number of attendees, the variety of events offered, and the successful organization by the committee. It effectively explains why the meeting was considered a huge success."
Which award was granted over the past year? To whom was it given?,The Traffic Bowl - First Place Award was granted over the past year. It was given to the University of Portland to encourage student participation in the Oregon Section ITE.,"Oregon Section 2007/2008 Annual Report  
Institute of Transportation Engineers  Page 13 of 1 3  
9.   AWARDS                             
 
The Oregon Section recognized several groups and individuals during 2007-08. The Section provided 
over $1,450 in awards to various ITE Student Sections throughout the gr eater Northwest. The awards 
granted over the past year are summarized below. 
 
Award Name: Traffic Bowl - First Place Award   
Recipient's Name:  University of Portland 
Purpose of Award:  To Encourage Student Participation in Oregon Section ITE 
Form of Award:  $400 to Student Chapter",Correct,The answer provides a clear and accurate response to the question by identifying the award (Traffic Bowl - First Place Award) and who it was given to (University of Portland). The explanation also includes additional context about the purpose of the award.
How do you think sexual harassment as an issue is peculiar to Australian workplaces?,Sexual harassment in Australian workplaces is peculiar due to the current legislation placing the onus on victims to seek redress rather than on employers to prevent harm. The Individual Complaint Model requires victims to make a complaint before pursuing a remedy for unlawful harassment. The persistent prevalence of sexual harassment suggests that the current legislation has failed in preventing such conduct.,"Page 7 
  
i. Positive obligation on employers  
 
Sexual harassment in the workplace has been prohibited in Australia since the passing of the 
Sex Discrimination Act 1984  (Cth) (‘ SDA ’). However, the persistent prevalence of sexual 
harassment within Australian workplaces since that time suggests that the current legislation 
has failed in preventing this kind of conduct.  
 
Maurice Blackburn is of the view that one of the significant failings of the current legislative 
scheme is the onus it places on victims to seek redress for the harm they have suffered, 
rather than placing a positive obligation on employers to prevent the harm occurring in the 
first instance.   
 
The current legislative scheme requires victims of sexual harassment to take the step of 
making a complaint before they are able to pursue a remedy in relation to the unlawful 
harassment (‘ the Individual Complaint M odel’ )5.",Correct,"The answer provides a clear explanation of why sexual harassment is peculiar to Australian workplaces, highlighting the current legislation's focus on victims seeking redress rather than employers preventing harm. It also mentions the Individual Complaint Model and the failure of the legislation in preventing sexual harassment."
What legislative suggestions pertaining to workplace sexual harassment does the firm provide in its submission?,"The firm suggests implementing mandatory training on sexual harassment prevention for all employees. They also recommend establishing clear reporting procedures and support mechanisms for victims. Additionally, they propose stricter penalties for perpetrators of workplace sexual harassment.","Submission in Response 
to the National Inquiry into 
Sexual Harassment in 
Australian Workplaces  
 
 
February 2019",Correct,The student accurately identifies the legislative suggestions provided by the firm in its submission regarding workplace sexual harassment. The answer is detailed and covers all the key points mentioned in the question.
How does the scarcity of data on mediations impact the efficacy of the Complaints Process?,"The scarcity of data on mediations impacts the efficacy of the Complaints Process by limiting the understanding of outcomes in anti-discrimination and sexual harassment matters. This lack of information hinders the ability to assess the effectiveness of the mediation process in resolving complaints. Without sufficient data, it is challenging to make informed decisions and improvements to the Complaints Process.","complainants.  
 
Our primary and overriding submission in relation to the Individual Complaints System is that 
it is paramount that the AHRC be properly funded and fully staffed in order to fulfil its 
statutory objectives.  
 
Below we have identified three additional issues which impact the efficacy of the Complaints 
Process. They are related to:  
 
 Scarcity of data on med iations;  
 Employer tactics ; and  
 The mediation process  
 
These are discussed in more detail below:  
 
Scarcity of Data  on Mediations  
 
It should be noted that there have been very few Australian studies which have examined 
the outcomes of the mediation  process with respect to anti -discrimination matters, and 
even less with respect to sexual harassment matters specifically. This is largely due to 
                                                
19 Therese  MacDermott  (2015) ‘Reassessing Sexual Harassment: It's time’ Alternative Law Journal , 40(3), 157.",Correct,"The answer provides a clear explanation of how the scarcity of data on mediations affects the efficacy of the Complaints Process. It highlights the impact on understanding outcomes and assessing effectiveness, as well as the challenges in making informed decisions and improvements."
What and why the firm designates as one of the significant failings of the current legislative scheme?,"One of the significant failings of the current legislative scheme, according to Maurice Blackburn, is the onus it places on victims to seek redress rather than obligating employers to prevent harm. They advocate for enforceable sanctions against employers who fail to provide a safe workplace. Additionally, they believe that the timeframe for making a complaint through AHRC should be amended to 6 years.","Maurice Blackburn is of the view that one of the signif icant failings of the current legislative 
scheme is the onus it places on victims to seek redress for the harm they have suffered, 
rather than placing a positive obligation on employers to prevent the harm occurring in the 
first instance. We believe there should be enforceable sanctions against employers who fail 
in their duty to provide a safe workplace for their employees.  
 
We believe that it is important that the governing bodies of all organisations should be fully 
aware of the incidence of sexual haras sment in their workplace, and that they should be 
required to report on the number of reported incidents of sexual harassment, as part of their 
reporting requirements to Workplace Gender Equality Agency (‘WGEA’).  
 
We believe that the current legislated tim eframe for making a complaint through AHRC is 
unworkable and out of step with other legislative provisions. It should be amended to 6 years",Correct,"The answer provides a clear explanation of one significant failing of the current legislative scheme according to Maurice Blackburn. It also includes specific suggestions for improvement, showcasing a deep understanding of the topic."
In what cases should online sexual harassment be criminalized according to the submission?,"Online sexual harassment should be criminalized in cases where particularly nefarious behaviors are involved, and when individuals engage in such behavior through online platforms. It is important to hold all those who cause, enable, or expose others to online sexual harassment accountable, including employers and social media platforms. Given the scope and pervasiveness of online sexual harassment, a concurrent civil process may be necessary to provide citizens with the tools needed for appropriate redress.","This will necessitate criminalising particularly nefarious behaviours, and then providing the 
relevant police and regulatory services with the res ources to successfully prosecute people 
engaging in sexual harassment through on -line platforms.  
 
We believe that, for this to have the required deterrent effect, it is important that all those who 
cause, enable or expose people to on -line sexual harassmen t should be held to account, and 
this includes employers, and social media platforms, as well as those who generate and 
distribute the abusive material.  
 
We recognise, however, that given the scope and pervasiveness of on -line sexual 
harassment, no regulat or or law enforcement agency, no matter how well equipped, will be in 
a position to effectively deal with every case, let alone every extreme case. Hence the need 
for a concurrent civil process which provides citizens with the tools required to achieve 
appropriate redress.",Correct,"The answer provides a clear explanation of when online sexual harassment should be criminalized, mentioning nefarious behaviors, engagement through online platforms, accountability of various parties, and the need for a civil process for redress."
